<?xml version="1.0" encoding="UTF-8"?>
<!--
@author William
-->

<!ELEMENT users (user+)>

<!ELEMENT user (userType, userName, userPassword, userStatus)>
<!ELEMENT userType (#PCDATA)>
<!ELEMENT userName (#PCDATA)>
<!ELEMENT userPassword (#PCDATA)>
<!ELEMENT userStatus (#PCDATA)>